{
  "schemaVersion": "0.1.0",
  "authorityId": "CC-SA-CREATORS-COMMON-ENVELOPE-001",
  "authorityVersion": "0.1.0",
  "signer": {
    "partyId": "CC-INST-CREATORS-COMMON",
    "name": "Creators Common",
    "partyType": "institution"
  },
  "keyRefs": [
    "CC-TK-CREATORS-COMMON-ED25519-001",
    "CC-TK-CREATORS-COMMON-ED25519-002"
  ],
  "status": "active",
  "permissions": [
    {
      "permissionId": "CREATION-ENVELOPE-ISSUE",
      "recordTypes": [
        "creation"
      ],
      "actions": [
        "sign",
        "issue"
      ],
      "signatureScopes": [
        "payload-digest"
      ],
      "purposes": [
        "registry-issuance",
        "conformance-testing"
      ],
      "environments": [
        "creators-common-registry"
      ],
      "requireWardenDecision": false,
      "conditions": [
        "The referenced key must be active and valid at verification time.",
        "The payload digest must be calculated under CC-CJSON-0.1."
      ]
    }
  ],
  "assurance": {
    "identityLevel": "institutional",
    "keyCustodyLevel": "software",
    "multiPartyRequired": false,
    "minimumSignatures": 1
  },
  "validFrom": "2026-01-01T00:00:00Z",
  "review": {
    "reviewFrequencyDays": 90,
    "nextReviewAt": "2026-10-12T10:24:00Z",
    "reviewerRefs": [
      "CC-INST-WARDEN"
    ]
  },
  "issuer": {
    "issuerId": "CC-INST-WARDEN",
    "name": "Warden",
    "authorityRef": "docs/security/CC-TRUSTED-KEYS-AND-SIGNATURES-V0.1.md"
  },
  "provenance": {
    "sourceRecordRefs": [
      "docs/security/CC-TRUSTED-KEYS-AND-SIGNATURES-V0.1.md"
    ],
    "changeReason": "Initial synthetic signer-authority fixture"
  },
  "createdAt": "2026-07-14T10:24:00Z",
  "updatedAt": "2026-07-14T10:24:00Z"
}
